{
  "version": "1",
  "type": "finding",
  "component": "f7bea8e45539da2eb26841551a553418437d2a58",
  "location": {
    "path": "plugin.json",
    "start": 12,
    "end": 12
  },
  "criterion": "safe-to-run-with-access",
  "observation": "network-access-any-host",
  "check": "permissions",
  "model": "other"
}
