{
  "version": "1",
  "type": "finding",
  "component": "f7bea8e45539da2eb26841551a553418437d2a58",
  "location": {
    "path": "plugin.json",
    "start": 13,
    "end": 13
  },
  "criterion": "safe-to-run-with-access",
  "observation": "environment-access-all-variables",
  "check": "permissions",
  "model": "other"
}
